{"$id":"https://outerheavenx.github.io/citadel-of-vesper/schemas/boss_attack.schema.json","$schema":"https://json-schema.org/draft/2020-12/schema","additionalProperties":false,"description":"One boss attack pattern. Referenced from data/bosses.json (base attacks + phases[].addsAttacks). All patterns are original designs.","properties":{"bossId":{"description":"Boss this pattern belongs to (data/bosses.json id).","type":"string"},"cooldown":{"description":"Seconds before this attack can fire again.","minimum":0,"type":"number"},"damageMult":{"description":"Multiplier on the boss's stats.attack for this pattern.","minimum":0,"type":"number"},"flashColor":{"description":"Telegraph flash tint (decimal RGB) during windup.","type":"integer"},"hitPauseMs":{"description":"Scripted hit-pause (ms) on strike; clamped by EffectBudgets.","maximum":90,"minimum":0,"type":"number"},"hitStun":{"description":"Seconds of hitstun dealt to the player.","minimum":0,"type":"number"},"hitbox":{"additionalProperties":false,"description":"Melee strike box (kind 'melee').","properties":{"h":{"type":"number"},"offsetX":{"type":"number"},"offsetY":{"type":"number"},"w":{"type":"number"}},"required":["w","h"],"type":"object"},"id":{"pattern":"^[a-z0-9_]+$","type":"string"},"kind":{"description":"Execution kind interpreted by src/bosses/Boss.js.","enum":["melee","radial_ring","volley","summon","quake"],"type":"string"},"knockback":{"additionalProperties":false,"description":"Knockback applied to the player on hit.","properties":{"x":{"type":"number"},"y":{"type":"number"}},"type":"object"},"name":{"type":"string"},"projectiles":{"additionalProperties":false,"description":"Projectile params (kinds 'radial_ring', 'volley', 'quake').","properties":{"count":{"minimum":1,"type":"integer"},"lifeMs":{"minimum":1,"type":"number"},"size":{"minimum":1,"type":"number"},"speed":{"minimum":0,"type":"number"},"spreadDeg":{"description":"Total fan spread for 'volley' (degrees).","minimum":0,"type":"number"}},"type":"object"},"range":{"description":"Max horizontal distance (px) at which the AI considers this attack.","minimum":0,"type":"number"},"recover":{"description":"Seconds of recovery after the strike.","minimum":0,"type":"number"},"sfxStrike":{"description":"SFX id played on strike.","type":"string"},"sfxWindup":{"description":"SFX id played when the telegraph starts.","type":"string"},"shake":{"description":"Trauma (0-1) added to the screen-shake system on strike.","maximum":1,"minimum":0,"type":"number"},"strikeTime":{"description":"Seconds the strike stays active.","minimum":0,"type":"number"},"summon":{"additionalProperties":false,"description":"Summon params (kind 'summon').","properties":{"count":{"minimum":1,"type":"integer"},"enemyId":{"description":"Enemy id from data/enemies.json.","type":"string"},"maxAlive":{"description":"Skip the cast while this many summoned minions live.","minimum":1,"type":"integer"},"radius":{"description":"Horizontal spawn spread around the boss (px).","minimum":0,"type":"number"}},"type":"object"},"telegraph":{"description":"Human-readable tell description (design doc; the in-game tell is windup flash + sfx).","type":"string"},"type":{"description":"Damage type routed through DamageSystem.","enum":["physical","fire","ice","lightning","shadow","holy"],"type":"string"},"waves":{"additionalProperties":false,"description":"Ground-shockwave params (kind 'quake').","properties":{"count":{"minimum":1,"type":"integer"},"h":{"minimum":1,"type":"number"},"interval":{"description":"Seconds between waves.","minimum":0,"type":"number"},"speed":{"minimum":0,"type":"number"},"w":{"minimum":1,"type":"number"}},"type":"object"},"windup":{"description":"Telegraph duration (s) before the strike. Damage can never land during windup.","minimum":0,"type":"number"}},"required":["id","bossId","name","kind","telegraph","windup","strikeTime","recover","cooldown","range","damageMult","type","hitStun"],"title":"BossAttack","type":"object"}