[{"bossId":"chapel_warden","cooldown":2.6,"damageMult":1.35,"flashColor":16763978,"hitPauseMs":70,"hitStun":0.45,"hitbox":{"h":75,"offsetX":65,"offsetY":-28,"w":130},"id":"chapel_slam","kind":"melee","knockback":{"x":230,"y":-170},"name":"Chapel Slam","range":165,"recover":0.9,"sfxStrike":"enemy_hit","sfxWindup":"bell_chime","shake":0.5,"strikeTime":0.15,"telegraph":"raises both arms, candlelight flares along them","type":"physical","windup":0.85},{"bossId":"chapel_warden","cooldown":5.0,"damageMult":0.85,"flashColor":16772800,"hitPauseMs":0,"hitStun":0.3,"id":"bell_toll","kind":"radial_ring","knockback":{"x":140,"y":-90},"name":"Bell Toll","projectiles":{"count":10,"lifeMs":2600,"size":10,"speed":130},"range":999,"recover":1.0,"sfxStrike":"bell_chime","sfxWindup":"bell_chime","shake":0.3,"strikeTime":0.2,"telegraph":"lifts the chapel bell-chain; the air goes still, then rings","type":"holy","windup":1.0},{"bossId":"sable_matriarch","cooldown":2.2,"damageMult":1.15,"flashColor":13079359,"hitPauseMs":0,"hitStun":0.35,"hitbox":{"h":60,"offsetX":60,"offsetY":-24,"w":120},"id":"matriarch_sweep","kind":"melee","knockback":{"x":200,"y":-120},"name":"Matriarch's Sweep","range":150,"recover":0.7,"sfxStrike":"enemy_hit","sfxWindup":"page_rustle","shake":0.35,"strikeTime":0.18,"telegraph":"drags her train across the floor, dust rises in a line","type":"physical","windup":0.7},{"bossId":"sable_matriarch","cooldown":3.4,"damageMult":0.55,"flashColor":13079359,"hitPauseMs":0,"hitStun":0.25,"id":"grief_volley","kind":"volley","knockback":{"x":90,"y":-60},"name":"Grief Volley","projectiles":{"count":4,"lifeMs":3000,"size":8,"speed":170,"spreadDeg":24},"range":999,"recover":0.8,"sfxStrike":"wisp_hiss","sfxWindup":"wisp_hiss","shake":0.15,"strikeTime":0.3,"telegraph":"lifts her lantern high, pale light gathers inside it","type":"shadow","windup":0.9},{"bossId":"sable_matriarch","cooldown":9.0,"damageMult":0.0,"flashColor":10487807,"hitPauseMs":0,"hitStun":0.0,"id":"lantern_call","kind":"summon","name":"Lantern Call","range":999,"recover":1.2,"sfxStrike":"bell_chime","sfxWindup":"wisp_hiss","shake":0.2,"strikeTime":0.2,"summon":{"count":2,"enemyId":"cinder_wisp","maxAlive":3,"radius":90},"telegraph":"swings the lantern low; answering lights flicker at the floor","type":"shadow","windup":1.1},{"bossId":"sable_matriarch","cooldown":6.0,"damageMult":0.95,"flashColor":16763978,"hitPauseMs":60,"hitStun":0.4,"id":"throne_quake","kind":"quake","knockback":{"x":180,"y":-150},"name":"Throne Quake","range":999,"recover":1.1,"sfxStrike":"enemy_hit","sfxWindup":"enemy_hit","shake":0.45,"strikeTime":1.4,"telegraph":"drives her sceptre into the floor; cracks race outward","type":"physical","waves":{"count":3,"h":20,"interval":0.45,"speed":150,"w":26},"windup":1.0}]